{
  "task_id": "AT11-first-supervised-research-READY",
  "project_id": "lab-research-os",
  "project_root": "D:/20_代码项目/赛博课题组/40-work/lab-research-os",
  "expected_checkpoint": "20260927T222534-4ceb3f3a3a79",
  "owner": "Human PI (acceptance); Astra (state)",
  "objective": "PACKET_READY but not authorized to execute: one source-linked four-row evidence card (maximum 600 Chinese words) for S1 DOI 10.5194/bg-18-1451-2021; no synthesis or conclusion adoption.",
  "allowed_read_roots": [
    "D:/20_代码项目/赛博课题组/40-work/lab-research-os/artifacts/at11/A-FIRST-RESEARCH-SCOPE.md",
    "D:/20_代码项目/赛博课题组/40-work/lab-research-os/artifacts/at11/B-SUPERVISED-RESEARCH-PACKET.md",
    "D:/20_代码项目/赛博课题组/40-work/lab-research-os/artifacts/at11/C-REVIEW-ACCEPTANCE-PLAN.md",
    "D:/20_代码项目/赛博课题组/40-work/lab-research-os/artifacts/at11/D-SOURCE-BINDING.md",
    "D:/10_学业科研/论文_沉积物磷/01_我的阅读资料/2026/2026-08/2026-08-03_第003期/03_SCI_中科院二区/01_论文原文/论文_van de Velde等_2021_盐沼沉积物生物扰动与磷埋藏.pdf"
  ],
  "write_paths": [
    "D:/20_代码项目/赛博课题组/40-work/lab-research-os/artifacts/at11-research-run/EVIDENCE-CARD.md",
    "D:/20_代码项目/赛博课题组/40-work/lab-research-os/artifacts/at11-research-run/REVIEW.md",
    "D:/20_代码项目/赛博课题组/40-work/lab-research-os/artifacts/at11-research-run/DISPOSITION.md"
  ],
  "excluded_scope": [
    "No execution until separate Human PI run authorization is recorded against the current packet and checkpoint",
    "No private corpus transmission, copying raw PDF/notes, publication, source mutation, new sources, browsing or downloads",
    "No code, scientific synthesis, visual/numeric extraction, automatic knowledge promotion or checkpoint writes",
    "No AT09 promotion, successor, F5/F6, permanent roles, AT12, retries or recursive review"
  ],
  "input_evidence_ids": [
    "decision-0006",
    "decision-0007",
    "E-AT11-INDEX",
    "E-AT11-S1-ORIGINAL",
    "S1-doi-10.5194/bg-18-1451-2021"
  ],
  "acceptance_criteria": [
    "Use only the exact read-only S1 original bound by Decision 0007; missing/unreadable/conflicting identity holds the run",
    "Distinct Research/Evidence executor and gpt-6-sol scientific QA reviewer at reasoning effort high have suitable actual capability and traceable session/model/effort/harness identity before start; no GPT 5.6 fallback",
    "Four-row card within 600 Chinese words, every claim has precise original page/section support or explicit not-reported label",
    "Review covers identity, fidelity and limitations; no unresolved consequential anomaly; Human PI explicitly accepts only internal draft use",
    "Astra records claim/evidence/classification/consequence/authority/disposition; no result accepted through model PASS or checkpoint alone"
  ],
  "verification_route": "Future only: Research/Evidence executor -> independent gpt-6-sol scientific QA review at reasoning effort high -> Human PI acceptance -> Astra disposition. One executor call and one reviewer call, no retries or GPT 5.6 fallback; missing suitability, runtime identity or evidence means HELD. See artifacts/at11/C-REVIEW-ACCEPTANCE-PLAN.md.",
  "budget": {
    "max_files": 8,
    "max_depth": 4,
    "max_model_calls": 2
  },
  "resume_action": "STOP PACKET_READY. Source S1 is bound by Decision 0007, but no execution is authorized. Before any future run, obtain separate Human PI authorization, confirm executor/reviewer suitability and availability, rebind expected_checkpoint to current LATEST if it changed, validate the packet, then execute only the declared write set. No automatic execution or retry."
}
