{
  "task_id": "AT02-pilot-C",
  "project_id": "lab-research-os",
  "project_root": "C:/Users/ASUS/Documents/Codex/2026-09-05/gu/ai-web-briefing-hub/40-work/lab-research-os",
  "expected_checkpoint": "20260921T183037-034ade6bf069",
  "owner": "pilot-C-worker",
  "objective": "Metadata-only sample of one literature storage area; structure/index naming/project association/duplicate candidates and unknowns, no paper reading.",
  "allowed_read_roots": [
    "C:/Users/ASUS/Documents/Codex/2026-09-05/gu/ai-web-briefing-hub/40-work/lab-research-os",
    "D:/A每日论文阅读_沉积物磷形态与生物地球化学"
  ],
  "write_paths": [
    "C:/Users/ASUS/Documents/Codex/2026-09-05/gu/ai-web-briefing-hub/40-work/lab-research-os/artifacts/at02/pilot-C"
  ],
  "excluded_scope": [
    "No secrets/auth/env/config values",
    "No source changes, deletion or migration",
    "No full drive/corpus scanning",
    "No checkpoint writes or model calls during collection"
  ],
  "input_evidence_ids": [],
  "acceptance_criteria": [
    "Load latest committed state and record input context",
    "Schema-valid records with exact primary evidence/hashes",
    "No claims beyond bounded observations",
    "Independent DeepSeek verification required before integration"
  ],
  "verification_route": "Separate DSH DeepSeek Flash text evidence review after deterministic validation",
  "budget": {
    "max_files": 30,
    "max_depth": 2,
    "max_model_calls": 0
  },
  "resume_action": "Read packets/at02-pilot-C.md and protocols/AT02-PILOTS.md; write candidate artifacts, retain failure evidence."
}
